{
  "selected_model_explainability_schema_version": "1.0",
  "selected_model_explainability_version": "p1.2b-v1",
  "availability_status": "generated",
  "selected_model_id": "random_forest",
  "model_family": "RandomForestRegressor",
  "estimator_library": "scikit-learn",
  "estimator_library_version": "1.9.0",
  "model_parameters": {
    "n_estimators": 200,
    "max_depth": 4,
    "min_samples_leaf": 3,
    "max_features": 1.0,
    "bootstrap": true,
    "random_state": 42,
    "n_jobs": 1,
    "criterion": "squared_error"
  },
  "adopted_model_parameters_sha256": "ac37d2d2947de2f6004d39ecdfa3290c5d65901b796f1eb1fd248ad658e1b1e0",
  "estimator_role": "selected_model_chronological_holdout_validation_instance",
  "target": "target_cases_next_2w",
  "forecast_horizon": {
    "value": 2,
    "unit": "weeks"
  },
  "feature_names": [
    "rainfall_lag_2w",
    "rainfall_lag_4w",
    "temp_lag_2w",
    "temp_lag_4w",
    "humidity_lag_2w",
    "humidity_lag_4w",
    "cases_lag_1w",
    "cases_lag_2w",
    "cases_lag_4w",
    "cases_rolling_3w",
    "cases_rolling_4w",
    "cases_rolling_8w",
    "growth_rate_1w",
    "growth_rate_2w",
    "epi_week_sin",
    "epi_week_cos",
    "monsoon_flag",
    "post_monsoon_flag"
  ],
  "feature_formula_ids": [
    "FEATURE.CLIMATE_LAGS",
    "FEATURE.CASE_LAGS",
    "FEATURE.CASE_ROLLING",
    "FEATURE.GROWTH_RATIOS",
    "FEATURE.SEASONAL_CYCLIC",
    "FEATURE.SEASON_FLAGS"
  ],
  "feature_order_sha256": "aeccbe517da452e1132f08c02599418523fb003280b11ff9cda66cfb3aa55a85",
  "training_period": {
    "start": {
      "epi_year": 2021,
      "epi_week": 6
    },
    "end": {
      "epi_year": 2023,
      "epi_week": 39
    }
  },
  "validation_period": {
    "start": {
      "epi_year": 2023,
      "epi_week": 40
    },
    "end": {
      "epi_year": 2024,
      "epi_week": 22
    }
  },
  "training_rows": 138,
  "validation_rows": 35,
  "validation_matrix_sha256": "d749da62bf6edfc81bab4bcb3731c86f649ae72b2d15628b4f72dc8ae66e329b",
  "evaluation_split": "legacy_final_chronological_20_percent",
  "importance_methods": [
    "native_random_forest_impurity_importance",
    "holdout_permutation_importance"
  ],
  "native_importance": [
    0.1517481363989209,
    0.4645192732683217,
    0.025854368248649076,
    0.010631449510743596,
    0.09018378239459146,
    0.018270240057577464,
    0.03132715986949189,
    0.007628015362149625,
    0.009334352722296125,
    0.029708095300686754,
    0.006399643175152573,
    0.015820372775059603,
    0.006130300918653169,
    0.010043033367355746,
    0.10648422822645102,
    0.014718607301729927,
    0.0011989411021694743,
    0.0
  ],
  "permutation_importance": [
    1.9000622288040045,
    5.2009127179176575,
    -0.0813210953753531,
    0.11984355597286829,
    -0.12842089975527388,
    0.014367913305501823,
    0.11858155284240883,
    -0.05942323606881974,
    1.0242359839964803,
    0.6174781447588519,
    0.6888797428400674,
    0.7333386829315611,
    -0.1294089812728016,
    0.2826589872225661,
    3.9346815641390265,
    0.29621576346770995,
    0.010990788854003064,
    0.0
  ],
  "permutation_std": [
    1.2531431266087791,
    2.0982824246289433,
    0.12369385301326492,
    0.13135360458235387,
    0.6760764740737599,
    0.14603478235127518,
    0.3929642931118583,
    0.1565418852882494,
    0.22071112230038664,
    0.44748257444959944,
    0.3289994306746661,
    0.461919680516212,
    0.1165007071314276,
    0.3546027937050798,
    1.8308156352491674,
    0.17528566864543504,
    0.010686334756191155,
    0.0
  ],
  "permutation_settings": {
    "scoring": "neg_mean_absolute_error",
    "n_repeats": 20,
    "random_state": 42,
    "n_jobs": 1,
    "max_samples": 1.0
  },
  "feature_ranking": [
    {
      "feature_name": "rainfall_lag_2w",
      "feature_index": 0,
      "native_importance": 0.1517481363989209,
      "permutation_mean": 1.9000622288040045,
      "permutation_standard_deviation": 1.2531431266087791,
      "permutation_is_negative": false
    },
    {
      "feature_name": "rainfall_lag_4w",
      "feature_index": 1,
      "native_importance": 0.4645192732683217,
      "permutation_mean": 5.2009127179176575,
      "permutation_standard_deviation": 2.0982824246289433,
      "permutation_is_negative": false
    },
    {
      "feature_name": "temp_lag_2w",
      "feature_index": 2,
      "native_importance": 0.025854368248649076,
      "permutation_mean": -0.0813210953753531,
      "permutation_standard_deviation": 0.12369385301326492,
      "permutation_is_negative": true
    },
    {
      "feature_name": "temp_lag_4w",
      "feature_index": 3,
      "native_importance": 0.010631449510743596,
      "permutation_mean": 0.11984355597286829,
      "permutation_standard_deviation": 0.13135360458235387,
      "permutation_is_negative": false
    },
    {
      "feature_name": "humidity_lag_2w",
      "feature_index": 4,
      "native_importance": 0.09018378239459146,
      "permutation_mean": -0.12842089975527388,
      "permutation_standard_deviation": 0.6760764740737599,
      "permutation_is_negative": true
    },
    {
      "feature_name": "humidity_lag_4w",
      "feature_index": 5,
      "native_importance": 0.018270240057577464,
      "permutation_mean": 0.014367913305501823,
      "permutation_standard_deviation": 0.14603478235127518,
      "permutation_is_negative": false
    },
    {
      "feature_name": "cases_lag_1w",
      "feature_index": 6,
      "native_importance": 0.03132715986949189,
      "permutation_mean": 0.11858155284240883,
      "permutation_standard_deviation": 0.3929642931118583,
      "permutation_is_negative": false
    },
    {
      "feature_name": "cases_lag_2w",
      "feature_index": 7,
      "native_importance": 0.007628015362149625,
      "permutation_mean": -0.05942323606881974,
      "permutation_standard_deviation": 0.1565418852882494,
      "permutation_is_negative": true
    },
    {
      "feature_name": "cases_lag_4w",
      "feature_index": 8,
      "native_importance": 0.009334352722296125,
      "permutation_mean": 1.0242359839964803,
      "permutation_standard_deviation": 0.22071112230038664,
      "permutation_is_negative": false
    },
    {
      "feature_name": "cases_rolling_3w",
      "feature_index": 9,
      "native_importance": 0.029708095300686754,
      "permutation_mean": 0.6174781447588519,
      "permutation_standard_deviation": 0.44748257444959944,
      "permutation_is_negative": false
    },
    {
      "feature_name": "cases_rolling_4w",
      "feature_index": 10,
      "native_importance": 0.006399643175152573,
      "permutation_mean": 0.6888797428400674,
      "permutation_standard_deviation": 0.3289994306746661,
      "permutation_is_negative": false
    },
    {
      "feature_name": "cases_rolling_8w",
      "feature_index": 11,
      "native_importance": 0.015820372775059603,
      "permutation_mean": 0.7333386829315611,
      "permutation_standard_deviation": 0.461919680516212,
      "permutation_is_negative": false
    },
    {
      "feature_name": "growth_rate_1w",
      "feature_index": 12,
      "native_importance": 0.006130300918653169,
      "permutation_mean": -0.1294089812728016,
      "permutation_standard_deviation": 0.1165007071314276,
      "permutation_is_negative": true
    },
    {
      "feature_name": "growth_rate_2w",
      "feature_index": 13,
      "native_importance": 0.010043033367355746,
      "permutation_mean": 0.2826589872225661,
      "permutation_standard_deviation": 0.3546027937050798,
      "permutation_is_negative": false
    },
    {
      "feature_name": "epi_week_sin",
      "feature_index": 14,
      "native_importance": 0.10648422822645102,
      "permutation_mean": 3.9346815641390265,
      "permutation_standard_deviation": 1.8308156352491674,
      "permutation_is_negative": false
    },
    {
      "feature_name": "epi_week_cos",
      "feature_index": 15,
      "native_importance": 0.014718607301729927,
      "permutation_mean": 0.29621576346770995,
      "permutation_standard_deviation": 0.17528566864543504,
      "permutation_is_negative": false
    },
    {
      "feature_name": "monsoon_flag",
      "feature_index": 16,
      "native_importance": 0.0011989411021694743,
      "permutation_mean": 0.010990788854003064,
      "permutation_standard_deviation": 0.010686334756191155,
      "permutation_is_negative": false
    },
    {
      "feature_name": "post_monsoon_flag",
      "feature_index": 17,
      "native_importance": 0.0,
      "permutation_mean": 0.0,
      "permutation_standard_deviation": 0.0,
      "permutation_is_negative": false
    }
  ],
  "negative_importance_policy": "Negative permutation values are preserved.",
  "causal_interpretation_allowed": false,
  "rolling_importance_stability_status": "not_evaluated_across_temporal_folds",
  "limitations": [
    "These diagnostics describe the selected Random Forest validation-model instance and do not directly explain the separately fitted all-data forecast instance.",
    "Feature importance is a model diagnostic and does not establish causality, biological mechanism, clinical importance, or stability across seasons.",
    "Diagnostics use deterministic synthetic data and one legacy chronological holdout."
  ],
  "deployment_id": "dhaka_south",
  "deployment_gate": "benchmark_only",
  "data_mode": "synthetic_capability_demonstration",
  "candidate_registry_sha256": "2e627f8a368a7e92cebd4ad62139b1050c7614559affd620e9a41738fd6a25d4",
  "comparison_artifact_sha256": "aca48af0fca992968a59f2c12845960520248bdfab851b7cddc6d7192a12352e",
  "adoption_status": "adopted_p1.2b",
  "adoption_policy_version": "p1.2b-v1",
  "formula_registry_version": "p1.3-v1",
  "formula_registry_sha256": "e67552dbe4b5a80b9a082f0beb3ff70ba0ad5378a25b845e8d195352df3357cc",
  "deployment_profile_sha256": "53fe1fb09aea994c34a5b3d6839b60092c777030445b8ec46c32520675a7233a",